{
  "$schema": "../schemas/sovereign-runtime-registry.schema.json",
  "version": "1.0.0",
  "authority": "LeeWay Standards",
  "canonicalHost": "Leeway VS Code",
  "sourceOfTruth": "LeeWay Standards is the governing body and canonical source for sovereign runtime identities.",
  "marketplaceExtension": {
    "publisher": "leeway",
    "name": "agent-lee-leeway-coding-system",
    "displayName": "Agent Lee LeeWay Coding System",
    "version": "1.1.8",
    "extensionId": "leeway.agent-lee-leeway-coding-system",
    "marketplaceUrl": "https://marketplace.visualstudio.com/items?itemName=leeway.agent-lee-leeway-coding-system",
    "vscodeUri": "vscode:extension/leeway.agent-lee-leeway-coding-system"
  },
  "projectionRule": "Projection runtimes, including Leeway VS Code, may consume canonical agents from LeeWay Standards but may not privately redefine or fork their sovereign identities.",
  "runtimeIdentity": {
    "host": "Leeway VS Code",
    "primarySovereignAgent": "agent-lee-prime",
    "visualGovernanceAgent": "leeway-visual-orchestrator-agent",
    "visualSubsystem": "leeway-visual-intelligence-system"
  },
  "models": [
    { "id": "qwen2.5-coder:1.5b", "purpose": "Lightweight coding and local routing" },
    { "id": "qwen2.5-coder:7b", "purpose": "Coding, classification, and tool orchestration" },
    { "id": "qwen2.5-coder:14b", "purpose": "Backend synthesis and heavier engineering" },
    { "id": "deepseek-coder-v2:16b", "purpose": "Heavy code synthesis and multi-file reasoning" },
    { "id": "llama3.1:8b", "purpose": "Scene generation and structural synthesis" },
    { "id": "llava:7b", "purpose": "Vision understanding and image interpretation" },
    { "id": "phi3:mini", "purpose": "Lightweight execution tasks" },
    { "id": "nomic-embed-text", "purpose": "Vector memory and retrieval" },
    { "id": "azr", "purpose": "Repair-loop reasoning" },
    { "id": "echo", "purpose": "Diagnostics, receipts, and memory continuity" }
  ],
  "sovereignAgents": [
    { "id": "agent-lee-prime", "role": "Final speaker and constitutional orchestrator", "source": "LeeWay Standards", "consumptionMode": "canonical" },
    { "id": "fs-nav-agent", "role": "Governed filesystem navigation and discovery", "source": "LeeWay Standards", "consumptionMode": "canonical" },
    { "id": "host-exec-agent", "role": "Approval-bound terminal execution", "source": "LeeWay Standards", "consumptionMode": "canonical" },
    { "id": "media-forge-agent", "role": "Media analysis and asset generation support", "source": "LeeWay Standards", "consumptionMode": "canonical" },
    { "id": "mutation-agent", "role": "Controlled workspace mutation and patch application", "source": "LeeWay Standards", "consumptionMode": "canonical" },
    { "id": "perception-agent", "role": "Web, browser, and external perception workflows", "source": "LeeWay Standards", "consumptionMode": "canonical" },
    { "id": "leeway-visual-orchestrator-agent", "role": "LVIS routing, reconstruction control, and export governance", "source": "LeeWay Standards", "consumptionMode": "canonical" },
    { "id": "shield-governor-agent", "role": "Security enforcement, boundary checks, and escalation control", "source": "LeeWay Standards", "consumptionMode": "canonical" },
    { "id": "attestation-marshal-agent", "role": "Verification receipts, approval evidence, and trust attestation", "source": "LeeWay Standards", "consumptionMode": "canonical" },
    { "id": "memory-warden-agent", "role": "Provenance-bearing memory policy and continuity control", "source": "LeeWay Standards", "consumptionMode": "canonical" },
    { "id": "threat-sentinel-agent", "role": "Threat detection, adversarial drift review, and safe-mode triggers", "source": "LeeWay Standards", "consumptionMode": "canonical" },
    { "id": "leeway-vector-reconstruction-worker", "role": "Vector reconstruction worker", "source": "LeeWay Standards", "consumptionMode": "governed-worker" },
    { "id": "leeway-voxel-reconstruction-worker", "role": "Voxel reconstruction worker", "source": "LeeWay Standards", "consumptionMode": "governed-worker" },
    { "id": "leeway-scene-reconstruction-worker", "role": "Scene reconstruction worker", "source": "LeeWay Standards", "consumptionMode": "governed-worker" },
    { "id": "leeway-depth-synthesis-worker", "role": "Depth synthesis worker", "source": "LeeWay Standards", "consumptionMode": "governed-worker" },
    { "id": "leeway-structural-fidelity-worker", "role": "Structural fidelity worker", "source": "LeeWay Standards", "consumptionMode": "governed-worker" },
    { "id": "leeway-asset-repair-worker", "role": "Asset repair worker", "source": "LeeWay Standards", "consumptionMode": "governed-worker" },
    { "id": "leeway-manifest-export-worker", "role": "Manifest export worker", "source": "LeeWay Standards", "consumptionMode": "governed-worker" },
    { "id": "leeway-project-integration-worker", "role": "Project integration worker", "source": "LeeWay Standards", "consumptionMode": "governed-worker" },
    { "id": "leeway-visual-memory-worker", "role": "Visual memory worker", "source": "LeeWay Standards", "consumptionMode": "governed-worker" }
  ],
  "mcpPlane": [
    { "id": "leeway-agent-registry", "category": "governance" },
    { "id": "leeway-desktop-commander", "category": "host" },
    { "id": "leeway-docs-rag", "category": "knowledge" },
    { "id": "leeway-health", "category": "health" },
    { "id": "leeway-insforge", "category": "build" },
    { "id": "leeway-memory", "category": "memory" },
    { "id": "leeway-planner", "category": "planning" },
    { "id": "leeway-playwright", "category": "browser" },
    { "id": "leeway-scheduling", "category": "time" },
    { "id": "leeway-testsprite", "category": "quality" },
    { "id": "leeway-validation", "category": "governance" },
    { "id": "frontend-mcp", "category": "engineering", "route": "qwen2.5-coder:7b" },
    { "id": "backend-mcp", "category": "engineering", "route": "qwen2.5-coder:14b" },
    { "id": "design-system-mcp", "category": "styling", "route": "qwen2.5-coder:7b" },
    { "id": "creative-mcp", "category": "media", "route": "llava:7b" },
    { "id": "memory-mcp", "category": "memory", "route": "nomic-embed-text" },
    { "id": "scheduler-mcp", "category": "time", "route": "llama3.1:8b" },
    { "id": "ui-builder-mcp", "category": "engineering", "route": "qwen2.5-coder:7b" },
    { "id": "leeway-build-auditor-mcp", "category": "optimization", "route": "deepseek-coder-v2:16b" },
    { "id": "leeway-ci-blueprint-mcp", "category": "optimization", "route": "qwen2.5-coder:7b" },
    { "id": "leeway-edge-optimizer-mcp", "category": "optimization", "route": "deepseek-coder-v2:16b" },
    { "id": "leeway-full-repo-checker-mcp", "category": "optimization", "route": "deepseek-coder-v2:16b" },
    { "id": "leeway-responsive-ui-mcp", "category": "optimization", "route": "qwen2.5-coder:7b" },
    { "id": "qa-mcp", "category": "quality", "route": "qwen2.5-coder:7b" },
    { "id": "react-native-mcp", "category": "mobile", "route": "qwen2.5-coder:7b" },
    { "id": "leeway-visual-intelligence-system", "category": "visual-intelligence" }
  ],
  "lvisWorkers": [
    { "id": "leeway-visual-orchestrator-agent", "role": "Visual-governance lead" },
    { "id": "leeway-vector-reconstruction-worker", "role": "Vector reconstruction" },
    { "id": "leeway-voxel-reconstruction-worker", "role": "Voxel reconstruction" },
    { "id": "leeway-scene-reconstruction-worker", "role": "Scene reconstruction" },
    { "id": "leeway-depth-synthesis-worker", "role": "Depth synthesis" },
    { "id": "leeway-structural-fidelity-worker", "role": "Structural fidelity scoring" },
    { "id": "leeway-asset-repair-worker", "role": "Asset repair" },
    { "id": "leeway-manifest-export-worker", "role": "Manifest export" },
    { "id": "leeway-project-integration-worker", "role": "Project integration" },
    { "id": "leeway-visual-memory-worker", "role": "Visual memory" }
  ],
  "runtimeDomains": [
    { "id": "safety", "authority": "LeeWay Standards", "doc": "Docs/governance/runtime-domain-safety.md" },
    { "id": "sandbox", "authority": "LeeWay Standards", "doc": "Docs/governance/runtime-domain-sandbox.md" },
    { "id": "workspace", "authority": "LeeWay Standards", "doc": "Docs/governance/runtime-domain-workspace.md" },
    { "id": "knowledge", "authority": "LeeWay Standards", "doc": "Docs/governance/runtime-domain-knowledge.md" },
    { "id": "logs", "authority": "LeeWay Standards", "doc": "Docs/governance/runtime-domain-logs.md" },
    { "id": "memory", "authority": "LeeWay Standards", "doc": "Docs/governance/runtime-domain-memory.md" },
    { "id": "patches", "authority": "LeeWay Standards", "doc": "Docs/governance/runtime-domain-patches.md" },
    { "id": "reports", "authority": "LeeWay Standards", "doc": "Docs/governance/runtime-domain-reports.md" }
  ],
  "governanceRules": [
    "schema-first",
    "local-first",
    "receipt-required",
    "deterministic-tools-first",
    "pending-edits workflow",
    "agent ownership",
    "auditability",
    "repair loops",
    "quality gates",
    "no blind edits"
  ]
}